question,answer,sort_order,active
What is Clara's Day Dive?,"Clara's Day Dive is a neighborhood coupe bar and patio in East Austin, Texas. We serve day drinks, spritzes, frozen cocktails, and zero-proof options in a warm, retro-playful setting with rotating food trucks and morning coffee.",1,TRUE
Where is Clara's Day Dive located?,"1814 E Cesar Chavez St, Austin, TX 78702 — on the east side, with a shaded dog-friendly patio open late.",2,TRUE
What are Clara's Day Dive hours?,Monday through Thursday 3pm to midnight; Friday noon to 2am; Saturday and Sunday 11am to 2am.,3,TRUE
Does Clara's Day Dive serve food?,We host rotating food trucks — Bird Bird Biscuit on weekdays and Veracruz tacos on weekends — plus morning coffee until noon.,4,TRUE
Can I book Clara's Day Dive for a private event?,Yes. We host birthdays, send-offs, and patio gatherings. Reach out to our event coordinator by email or phone — details are on the Book the bar section of our website.,5,TRUE
What drinks is Clara's Day Dive known for?,"House favorites include Clara's Spritz (Aperol, prosecco, grapefruit), frozen Frosé, the Penguin Punch zero-proof slush, and seasonal frozen Negronis.",6,TRUE
